	id_tweet	created_at	user_name	text	clean
452	1058558628838498304	2018-11-02 22:16:58	bogota_social	@EnriquePenalosa  adjudicó licitación  para comprar  1.143  buses contaminantes para  @Transmilenio:*El 59,7%= 682 buses tipo volvo diesel euro V; * 40,3% = 461 buses,  para skania, gas, euro VI. *Eléctricos= 0,0%.  Tecnologías rechazadas en todo el mundo por ser  obsoletas. https://t.co/xz1Tvc8y7B	    adjudicar licitación   comprar          bus contaminante                  bus tipo volvo diesel euro v                 bus    skania   gas   euro ver    eléctrico          tecnología rechazar mundo   obsoleto   
453	1073352404047929345	2018-12-13 18:02:09	bogotaampm	#Editorial @TransMilenio por la Carrera Séptima: Dudas y preguntas luego de abrirse licitación para su construcción #RadioRed970AM #RCNRadio https://t.co/vIoTi8cTFZ	  editorial    carrera séptimo   dudar y preguntar abrirse licitación construcción   radiar red    am   rcn radiar  
454	1069979913967550464	2018-12-04 10:41:05	bogotacity	.#Bogota: Así funcionará TransMilenio en diciembre https://t.co/JAGWklbpPU #BogotaCity #Movilidad	   bogota   funcionar trans milenio diciembre     bogota city   movilidad
455	1052631743889633280	2018-10-17 13:45:39	bravoamezquita	@salexbecerra_97 A ver Becerra, ¿cuál es tu problema? ¿muchos problemas de temperatura? 🧐	      a becerro    problema    problema temperatura   
456	1062872964192972801	2018-11-14 20:00:36	bsmbcol	Hahahaha Transmilenio es horriblemente bello. Patrimonio material, histórico y de memoria para varias generaciones colombianas. De la Capital de la República para el mundo. https://t.co/BZEYzMWRfi	hahahaha transmilenio horriblemente bello   patrimonio material   histórico y memoria generación colombiano   capital república mundo   
457	1069850591847964673	2018-12-04 02:07:12	calderonrichi	#UnDíaComoHoy4 de diciembre de 2000En Bogotá se inaugura el Sistema de transporte público TransMilenio, con buses articulados y carriles exclusivos en vías troncales. https://t.co/30KnFY3UvJ https://t.co/tiugM7biVW	  undía   diciembre      bogotá inaugurar sistema transportar público trans milenio   bus articular y carril exclusivo vía troncal     
458	1060304351372234752	2018-11-07 17:53:51	cam4076056	@Pao_Sinisterra @TransMilenio @CulturaenBta @sitpbogota @CanalCapital @EnriquePenalosa @integracionbta @Bogota @SectorMovilidad @BogotaTransito @idubogota @SeguridadBOG Sí, los servicios de Aguas ahora se detienen allí como el F23 y el B74	   sinisterra                          servicio aguar detener f    y b  
459	1048300999318933506	2018-10-05 14:56:49	camiloandres74	@AlvaroUribeVel Convoque la marcha Presidente yo lo sigo...	   convocar marchar presidente seguir   
460	1060678550322376704	2018-11-08 18:40:47	camilogonzlz	@RolaVendeHumo De acuerdo! mi hermana camina desde hace más de 2 horas desde La Tadeo y hace un momento dice que por la 80 no pasa un solo bus... todo el mundo caminando. @TransMilenio	     hermano caminar    tadeo y     paso bus     mundo caminar   
461	1055096622437273600	2018-10-24 09:00:12	capitano1989	La participación de @TransMilenio en el simulacro es mostrarnos como no va a haber servido en caso de un terremoto @TransMiseria	participación    simulacro mostrarnos a servir casar terremoto  
462	1073057307381116928	2018-12-12 22:29:33	carlitosbolanos	@JuanSQ1 @TransMilenio Correcto, la ciudad se debe mover como un todo es decir, metro, Transmilenio ,alimentadores, metro cable, tranvía, trenes y si es posible trasporte marítimo pero hay que avanzar coherentemente priorizando los problemas de masas ej. China, lo se porque lo vi, como Medellín por ej.	     correcto   ciudad mover   metro   transmilenio   alimentador   metro cable   tranvía   tren y trasporte marítimo avanzar coherentemente priorizar problema masa ej   chino   ver   medellín ej
463	1059093105264283654	2018-11-04 09:40:47	carmuzo	@lfafanador @TransMilenio @EnriquePenalosa @NoTM7a Otra cosa piensa el presidente de Chile, mire este vídeo corto acerca de la renovación de la flota de Trans-Santiago con 200 buses eléctricos de BUS China y 400 y pico buses Euro VIhttps://t.co/xv9CiCUpl3	         coser pensar presidente chile   mirar vídeo cortar acercar renovación flotar trans santiago      bus eléctrico bus chino y      y picar bus euro  
464	1059101421906337794	2018-11-04 10:13:50	carolmonroy_	Siempre pensé que los buses alimentadores de Transmilenio eran lo más demorado en el mundo... Al cabo de unos días descubrí que el bus más demorado del mundo es el que yo este esperando 😥 #TransportePublicoEnMiCiudad	pensar bus alimentador transmilenio demorar mundo     cabo descubrir bus demorar mundo esperar     transportar publicar ciudad
465	1059183428552269824	2018-11-04 15:39:42	casallas1000	@NoticiasCaracol que hueco ni que hueco , simplemente duque le tiene bronca a la clase media y nos va a pone a pagar el iva a todos los alimentos de primera necesidad ,  ponga a contribuir a las iglesias  cristianas , cuyos pastores viven como reyes ...........	   hueco hueco    simplemente duque bronco a clase medio y a poner a pagar iva a alimento necesidad     poner a contribuir a iglesia   cristiano    cuyo pastor vivir rey            
466	1063177364430114816	2018-11-15 16:10:11	cathenavarro	@TransMilenio @EnriquePenalosa @BogotaTransito @SectorMovilidad @CanalCapital @Bocarejo_JP @rutassitp @SeguridadBOG @YesidLancheros @JGarciaG1 Novedades porfa?	             jp          novedad porfa
467	1057580459532738561	2018-10-31 05:30:05	caycedo	@FlanaganDJ @Otra_Licenciada Aunque Melbourne tiene mejor clima que Amsterdam, curiosamente se hacen menos viajes en cicla al día allá abajo. La causa es que obligan a usar casco.	     licenciar melbourne clima amsterdam   curiosamente viaje ciclar allá abajar   causar obligar a cascar
468	1048566413860978688	2018-10-06 08:31:29	cbadelhugo	Madrugué a lavar ropa con una amigo en la casa comunitaria de la lavada de ropa, el clima estaba re peye, el man puso sistema solar y salió severo sol. Solo felicidad para este anciano.	madrugar a lavar ropa amigar casar comunitario lavar ropa   clima re peye   man poner sistema solar y salir severo sol   felicidad anciano
469	1065708194561970176	2018-11-22 15:46:48	cerb71	@idubogota @Bogota @GobiernoBTA @IDTBogota @Bocarejo_JP @sgeneralbogota @TransMilenio @CanalCapital @SectorMovilidad @UMVbogota @EnriquePenalosa solamente LLOVIO DURANTE UN HORA Y 15 MINUTOS MÁXIMO...NO ENGAÑEN A LA GENTE.	           jp              llovio hora y     minuto máximo    engañar a gente
470	1060992147846057985	2018-11-09 15:26:54	cesar44817	@NoticiasRCN @TransMilenio @jarithmo La demanda contra los lideres de la protesta ya estara lista	       demandar liderar protestar estara listo
471	1069780240954781696	2018-12-03 21:27:39	cesaralo	Según el Foro Económico Mundial, una persona de 78 años, duerme 25 años, se gasta 19 años viendo pantallas y publicidad, 6 años en el tráfico y 17 años trabajando. Le quedan 11 años para lo demás. En sexo (2 por semana) invierte solo 30 días. Pilas muchachos 💥	foro económico mundial   personar     año   dormir     año   gastar     año ver pantalla y publicidad     año tráfico y     año trabajar   quedar     año   sexo     semana   invertir       pilar muchacho  
472	1053288844102111232	2018-10-19 09:16:44	cesarsep1974	@NoticiasCaracol Quisiera ver al flamante alcalde movilizándose en transmilenio todos los días.	   querer flamante alcalde movilizándose transmilenio
473	1066207178644697088	2018-11-24 00:49:35	chelo1215	Eso parece concejal @Juan_Florez, el flamante alcalde @EnriquePenalosa vuelve y juega, en su 1era alcaldía nos hizo conejo imponiendo su detestable @TransMilenio, otra vez conejo, privilegiando a un sólo oferente,  no hay derecho con Bogotá, puro serrucho, esa plática se perderá. https://t.co/nxh4ikNJ0G	concejal    florez   flamante alcalde    volver y jugar     alcaldía conejo imponer detestable     conejo   privilegiar a oferente    derecho bogotá   puro serrucho   plática perder   
474	1056576375333756930	2018-10-28 11:00:12	confidencialcol	Muere el dueño del Leicester en un accidente de helicóptero a las afueras del estadio https://t.co/rdQUmmerfn	morir dueño leicester accidentar helicóptero a aforar estadio  
475	1070317971694936070	2018-12-05 09:04:24	corficolombiana	"""""""""""""""""""""""""""""""Nuestro economista jefe @JulioCRomeroA comenta que """"""""""""""""""""""""""""""""se evidencia un repunte de la economía colombiana que, aunque lento, ya marca un cambio de tendencia después del fuerte choque de materias primas de 2014"""""""""""""""""""""""""""""""". https://t.co/ADFmV2ILQP"""""""""""""""""""""""""""""""	                economista jefe    comentar                  evidenciar repuntar economía colombiano   lento   marcar cambiar tendencia fuerte chocar materia primo                        
476	1055589776643014656	2018-10-25 17:39:49	cosmomimes	Charla enfocada a destacar las diferencias evolutivas, anatómicas, dietarias y comportamentales existentes entre los osos y los perezosos. Además de alertar sobre la relación preconciente entre la palabra oso-peluche y mascota, para prevenir el tráfico de perezosos. https://t.co/hPmOzO9gt5	charlar enfocar a destacar diferenciar evolutivo   anatómico   dietarias y comportamentales existente oso y perezoso   alertar relación preconciente palabra osar peluche y mascota   prevenir tráfico perezoso   
477	1065692733841510401	2018-11-22 14:45:22	cristianc_y	@BluRadioCo @AlvaroUribeVel Sí hubieran reducido el congreso y el sueldo de congreso y si devolvieran la plata de isagem, AGROINGRESO, OBREDETH, reficar, vías 4G, túnel de la línea, Panamá papers, tendríamos los recursos para educación y el hueco fiscal.	     haber reducir congreso y soldar congreso y devolver plata isagem   agroingreso   obredeth   reficar   vía   gramo   túnel líneo   panamá papers   tener recurso educación y hueco fiscal
478	1051809997976420352	2018-10-15 07:20:19	danielaavila_	No se imaginan que es caminar casi por una hora, a las 4 de la mañana, y en una temperatura de 5 grados ❄️😴	imaginar caminar hora   a    mañana   y temperatura    grado    
479	1072994084640428032	2018-12-12 18:18:19	danielbernalb	El grave problema de la pésima #CalidadDelAire reportado en estación subterránea @TransMilenio Museo Nacional, que parece cámara de gases 😷, se repetirá en #LaNuevaSeptima pues tendrá varias subte sr @EnriquePenalosa @Bocarejo_JP ¿o aquí sí les servirán los eléctricos? https://t.co/wR9O6nYcKy	gravar problema malo   calidad aire reportar estación subterráneo    museo nacional   cámara gas     repetir   septima subte sr      jp   o servir eléctrico   
480	1076159774100779008	2018-12-21 11:57:38	danielfpolania	En Austria los ratones se comen las cuerdas del órgano dela iglesia, lo que impide que haya música en la misa de #navidad, la tristeza que le produjo el incidente al cura lo llena de inspiración para componer unacanción que se cante con el sonido de la voz, nacerá Noche Paz. https://t.co/QQ3VpzpaEL	austria ratón comer cuerdo órgano dela iglesia   impedir músico misa   navidad   tristeza producir incidente curar lleno inspiración componer unacanción cantar sonido voz   nacer noche paz   
481	1049685162601209863	2018-10-09 10:36:59	deespacio	"""""""""""""""""""""""""""""""Muchas gracias @TranspGenderLab y @elespectador por el reconocimiento a nuestra actividad """"""""""""""""""""""""""""""""Que tu acoso no nos toque"""""""""""""""""""""""""""""""" que hace parte de una campaña mucho más grande que busca recuperar la cultura ciudadana en @TransMilenio https://t.co/7I3ubnRh2F"""""""""""""""""""""""""""""""	                gracia    y    reconocimiento a actividad                  acosar tocar                  campaña grande buscar recuperar cultura ciudadano    
482	1047845930282758145	2018-10-04 08:48:32	destroucs	salí a afrontar el día con toda la actitud positiva y una cucha hizo que se me quedara atrapada la maleta en la puerta del sitp https://t.co/Bx3yluhmWd	salir a afrontar actitud positivo y cucha quedar atrapar maleta puerta sitp  
483	1057623288174821377	2018-10-31 08:20:16	destroucs	Quiero disfrazar mi cuello de marcas de neumático de sitp.	querer disfrazar cuello marcar neumático sitp
484	1063253233454374912	2018-11-15 21:11:39	dhidalgo65	@katzenschaeler @EspinosaRadio @dw_espanol @Bogota @TransMilenio Yo no veo problema en subsidiar la trancisión a cero emisiones de tubo de escapeEs una inversión social efectiva Debe existir un marco para ello, con apoyo Nacional (como en Chile o en China)Si veo problema en cuota que preselecciona a un solo proponente interesado	       espanol      ver problema subsidiar trancisión a cero emisión tubo escapar inversión social efectivo existir marcar   apoyar nacional   chile o chino ver problema cuota preseleccionar a proponente interesar
485	1047149277330460673	2018-10-02 10:40:17	dhidalgo65	.@Bogota sigue disminuyendo el número de muertes en el tráfico (4%  enero-agosto 2018 respecto al mismo periodo de 2017)Importante reducción en peatones Estabilidad en motociclistas @Bocarejo_JP Segumos reforzando #VisiónCeroBOG, gestión de velocidad https://t.co/gEVeESGXrc	    disminuir número muerte tráfico       enero agostar       periodo       importante reducción peatón estabilidad motociclista    jp segumos reforzar   visión cerobog   gestión velocidad  
486	1053988162157076480	2018-10-21 07:35:34	didiervdh	@saludhernandezm En los años 20's perdieron la vida centenares de agentes, controlando la fabricación y el tráfico ilegal del alcohol. Hoy ya no se mueren.	   año     segundo perder vida centenar agente   controlar fabricación y tráfico ilegal alcohol   morir
487	1046762579585060869	2018-10-01 09:03:41	diegoakvargas	"""""""""""""""""""""""""""""""""""""""""""""""""""""""""""""""Chile en 2016 tenía cerca de 12 muertes por cada 100 mil habitantes por tránsito, en la región estábamos bien, frente a la OCDE estábamos bien MAL, éramos el peor país, lejos de Suecia con 2,8 muertes por cada 100 mil habitantes"""""""""""""""""""""""""""""""" @PaolaTapiaSalas exMinistra de Transportes"""""""""""""""""""""""""""""""	                                chile           muerte      mil habitante tránsito   región estar   frente a ocde estar   ser país   suecia      muerte      mil habitante                    ministro transporte               
488	1075761038388273153	2018-12-20 09:33:12	diegoamayav	@idubogota @UMVbogota @Bocarejo_JP @EnriquePenalosa Sería importante que se reparará la junta de Dilatación del puente vehicular de la Cl 80 ir Av Boyacá es una vergüenza tener que soportar este hueco que genera grandes trancones sobre la cl80.Señores donde esta la supervicion	       jp    importante reparar junto dilatación puente vehicular centilitro     av boyacá vergüenza soportar hueco generar trancones centilitro    señor supervicion
489	1050024032681234432	2018-10-10 09:03:32	diegobta0	@gaitan_presente @HOLLMANMORRIS Mas grande que reficar... uy ese bobo litro del peñalosa quiere dejar a los bogotanos en la quiebra, no le basta su transmilenio tan malo y caro. @EnriquePenalosa usted es el cáncer de bogota anciano	   presentar    grande reficar     uy bobo litro peñalosa dejar a bogotano quebrar   basto transmilenio malo y caro     cáncer bogota anciano
490	1057303669580988416	2018-10-30 11:10:13	diegoguitar1	@ovalle2707 @Juan_Florez @TransMilenio @ECOPETROL_SA Hay muchas alternativas,  buses eléctricos por ejemplo.  El problema es que Peñalosa quiere que sea euro v para que gane volvo la licitación.  Aquí hay un claro problema de conflicto de intereses.	     florez      sa alternativo    bus eléctrico    problema peñalosa euro v ganar volvo licitación    problema conflicto interesar
491	1052568876657991682	2018-10-17 09:35:50	diegokarachas	@dhidalgo65 @ClaudiaLopez @MetroBogota Hola Darío, pero en ese entonces pensaban que salía más barato, no era claro que no iba a quedar independiente de TransMilenio y además que tendría estaciones más alejadas y con una menor capacidad, si hay envidia con Quito.	       hola darío   pensar salir barato   ir a quedar independiente trans milenio y tener estacionar alejar y menor capacidad   envidiar quitar
492	1072553004467961862	2018-12-11 13:05:37	dilialucia	Jajaja tras de cotudo con paperas ¿Qué hizo por que hubieran buses eléctricos en la licitación de Transmilenio? Nada. Antes le salimos a agradecer un proyecto para el 2040. Descarado! https://t.co/eMRQdq0XWP	jajaja cotudo paperas   haber bus eléctrico licitación transmilenio     salir a agradecer proyectar        descarar   
493	1050847180561498112	2018-10-12 15:34:26	donborji	- Dicen dizque Petro se apropió de la marcha estudiantil.- Ni idea. Ese día estaba muy ocupado y no vi.- Pero usted qué opina?- Nada porque me acabo de enterar.- Ese importaculismo suyo.- Ok. Yo también creo que se la apropió. Contento?- Cómo va a decir eso?*Así son. 😒	   dizque petro apropiar marchar estudiantil    ideo   ocupar y ver    opinar    acabar enterar    importaculismo    ok   apropiar   contentar    a     
494	1046764647116951553	2018-10-01 09:11:54	dpazmino	#lamadre para esos usuarios de @TransMilenio que cuando llevan morral no lo ponen en la parte de adelante y hacen estorbo #BogotáHumana	  lamadre usuario    llevar morral poner y estorbar   bogotáhumana
495	1073764551248830464	2018-12-14 21:19:53	drborrego21	No más atropello contra el gremio médico, no más amarillismo, no más sucio en la vida de una excelente persona y profesión al de la salud #yoapoyoalDrSancez	atropellar gremio médico   amarillismo   sucio vida excelente personar y profesión salud   yoapoyoal dr sancez
496	1051633285472931840	2018-10-14 19:38:08	ducu__u	Me contaron que el pelado que sobrevivió al accidente del Volkswagen quedó frito llaves. Que le preguntaban que si iba a ir al funeral de las hermanas y contestaba que de qué hablaban,que ellas estaban vivas. Que en la madrugada se despertaba gritando LAS MATÉ y volvía a dormirse	contar pelar sobrevivir accidentar volkswagen freír llave   preguntar ir a funeral hermano y contestar hablar vivo   madrugar despertar gritar matar y volver a dormirse
497	1073191889120186369	2018-12-13 07:24:19	eClipssi	Las imágenes aéreas grabadas con un dron muestran un amasijo de hierro y escombros con al menos 9 muertos.https://t.co/RYOIOV2GFa Via PlayGrounder https://t.co/esN6PrVc8v	imagen aéreo grabar dron mostrar amasijo herrar y escombro    muerto    via play grounder  
498	1061971712164745217	2018-11-12 08:19:21	ecoglobal_expe	¡Lluvia de estrellas en los Llanos Orientales con Ecoglobal Expeditions! - https://t.co/ud7StkA0yT	  lluvia estrellar llano oriental ecoglobal expeditions     
499	1050512239424200704	2018-10-11 17:23:30	edgarAmontenegr	@losoriginales @jaimesancristo @udsnoexisten la semana pasada en el bus que iba se subio un colombiano a vender me parecio curioso porque al transmilenio solo se suben venezolanos a vender ultimamente	       semana bus ir subio colombiano a vender parecio curioso transmilenio subir venezolano a vender ultimamente
500	1065670484476510208	2018-11-22 13:16:57	edgarrolarte	@neutrallogic @Angela___06 @JairGiraldo25 @IndomableLeon @ingeniero0013 Pero si el genio que se dice ser ambientalista no renovó los buses y extendió su vida útil por más años, le agradecemos? ptb por el SITP provisional con buses viejos? o por el incremento del mototaxismo?	                genio ambientalista renovar bus y extender vida útil año   agradecer   ptb sitp provisional bus viejo   o incrementar mototaxismo
501	1067940823604621312	2018-11-28 19:38:28	edidiazm	@TransMilenio Jajaja y ustede todos los días se demoran en enviar los buces y una frecuencias pésimas y uno bien cansado queriendo llegar a casa	   jajaja y ustede demorar enviar buzar y frecuencia malo y cansar querer llegar a casar
502	1057685366487072769	2018-10-31 12:26:56	eduardobula25	@tuitteroxeneize @mavegol @m_benedetto La protesta sobre el resultado del partido se basa en el artículo 56 que sostiene que se modificará por A) Alineación indebida, B) Supuestos de corrupción arbitral C) Incidente grave que haya tenido incidencia. Esto último es lo que reclamará Gremio.	       benedetto protestar resultar partir basar artículo     sostener modificar a   alineación indebido   b   supuesto corrupción arbitral c   incidente gravar incidencia   reclamar gremio
503	1076917201809088515	2018-12-23 14:07:23	edwardalarcon3	@JUANVIALPARRA @SectorMovilidad @Bocarejo_JP @alcaldiausaquen @usaquenET @CanalCapital @Bogota @idubogota @UMVbogota @dhidalgo65 Un accidente Asesino culpable ?	       jp                accidentar asesinar culpable  
504	1065608842015313922	2018-11-22 09:12:00	edwes_	O sea que piensan que cuando estos niños crezcan todavía vamos a tener TM. JAJAJAJAJA ¿Algún día Bogotá va a evolucionar? https://t.co/TbIVyEwkmB	o pensar niño crecer a tm   jajajajaja   bogotá a evolucionar   
505	1057979131504271365	2018-11-01 07:54:15	edwin_outlook	@darey1976 @NoticiasCaracol Lo que quiere es sacar más impuesto y cosas para los motociclistas peaje ect pero nesecita una excusa yo veo todos los días accidente de carros fantasmas y los malos son los de las motos	     sacar imponer y motociclista peaje ect nesecita excusar ver accidentar carro fantasma y malo moto
506	1055190840371539968	2018-10-24 15:14:35	eldementiras	Y si se evacúa el lugar por que hijueputas en la última foto está tan cerca el camarógrafo de la bomba y el robotcito.No señooooor. https://t.co/qMWP48KD2G	y evacuar hijueputas foto camarógrafo bombo y robotcito señooooor   
507	1071245482481991682	2018-12-07 22:30:00	elespectador	Libre hombre señalado de empujar a joven a carril de Transmilenio. https://t.co/zFQnxGkTJL https://t.co/fsRXU38orh	librar hombre señalar empujar a joven a carril transmilenio     
508	1062278904772055041	2018-11-13 04:40:01	elespectador	La temperatura en los Pirineos ha aumentado un 30% más que la media mundial.https://t.co/PsM9Iys84F https://t.co/vTb8zbdfcR	temperatura pirineo aumentar      medio mundial    
509	1048089400507162624	2018-10-05 00:56:00	elespectador	La explícita manifestación de un grupo activista en Cali por el Día Mundial de los Animales.https://t.co/Bxia6e4m7e https://t.co/U13M98lrvF	explícito manifestación grupo activista cali mundial animal    
510	1076177706407084037	2018-12-21 13:08:54	elespectador	Portal Américas de Transmilenio tendrá 260 biarticulados a gas. https://t.co/n0G7Rw80xu https://t.co/UGxACEFFTE	portal américas transmilenio      biarticulados a gas     
511	1053946494557061120	2018-10-21 04:50:00	elespectador	Presidente Duque rindió homenaje a militares muertos en accidente aéreo.https://t.co/bqBhaUGqET https://t.co/DWIkI6NdMF	presidente duque rendir homenaje a militar muerto accidentar aéreo    
512	1067753472223698944	2018-11-28 07:14:00	elespectador	¡Tome precauciones! Estas son las rutas de las marchas de mañana en Bogotá. https://t.co/hSChEoSdSQ https://t.co/GlTJHnzkSS	  tomar precaucionar   ruta marchar mañana bogotá     
513	1063547257012846594	2018-11-16 16:40:00	elespectador	#EnContexto “El Chapo” Guzmán es acusado de liderar entre 1989 y 2014 el cartel de Sinaloa, al que fundó y convirtió en la mayor organización de tráfico de droga del mundo. https://t.co/4FVUUuPImr	  contexto   chapar   guzmán acusar liderar       y       cartel sinaloa   fundar y convertir organización tráfico drogar mundo   
514	1074675075050336256	2018-12-17 09:37:59	elespectador	Ingenieros de la U. Nacional crean sistema que determina la eficiencia de buses del SITP. https://t.co/U0ha6rK83q https://t.co/KwFmrWM4Bx	ingeniero u   nacional creer sistema determinar eficiencia bus sitp     
515	1054131463585583104	2018-10-21 17:05:00	elespectador	Listos prepliegos para licitación de Transmilenio por la Séptima. https://t.co/E19PjghK1H https://t.co/vh8E7jLXJJ	listo prepliegos licitación transmilenio séptimo     
516	1054161662700208130	2018-10-21 19:05:00	elespectador	Listos prepliegos para licitación de Transmilenio por la Séptima. https://t.co/E19PjghK1H https://t.co/Ev35kDEXTU	listo prepliegos licitación transmilenio séptimo     
517	1057374080062705664	2018-10-30 15:50:00	elespectador	#HagamosMemoria  Si hay una costumbre bien colombiana y que gusta mucho en la política es la de cambiar las reglas de juego sobre la marcha. Hablemos de alargar el periodo de alcaldes y gobernadores. https://t.co/WTjwvkzff8 https://t.co/5sux5l5JGl	  hacer memoria   costumbre colombiano y gustar político cambiar reglar jugar marchar   hablar alargar periodo alcalde y gobernador     
518	1057150103813681154	2018-10-30 01:00:00	elespectador	El choque entre Petro y el uribismo por el cartel de Medellín.https://t.co/9aIhtPnVOJ https://t.co/2kXvhNa4zd	chocar petro y uribismo cartel medellín    
519	1060735197677793280	2018-11-08 22:25:53	elimprudenteCO	@NicoDuRo @patriotaamigo @EfectoMajo @freddy20ardila @JoseCuelloB @linamcardonag Entonces justificas poner en peligro al conductor y su porpiedad? Atropello a dos personas, destrocemos el panorámico....	             justificar peligrar conductor y porpiedad   atropellar a personar   destrozar panorámico    
520	1073400764075311104	2018-12-13 21:14:19	elpalabrista	Las carpas pasando el paso nivel detienen a los ciclistas, están regalando algo, y edtos invadieron carril de @transmilenio. No hay ni un auxiliar bachiller ni un guardián de ciclovía. Av Eldorado frente a gran estación https://t.co/6gq1w6qIZS	carpir pasar pasar nivel detener a ciclista   regalar   y edtos invadir carril     auxiliar bachiller guardián ciclovía   av eldorado frente a estación  
