	id_tweet	created_at	user_name	text	clean
948	1050008213142294528	2018-10-10 08:00:40	Juancamilobg	Como dijo el sabio y talentoso @DanielSamperO  “Un muchacho educado es un pachito menos”	sabio y talentoso      muchacho educar pachito
949	1047816604489269248	2018-10-04 06:52:00	MONTOYAANGELIK	#enlavialavida 🚴🏼‍♀️🚴🏼‍♂️#niunomas #Bocarejorenuncie marcha x el derecho ala vida y la movilidad @TransMilenio @PORLAMOVILIDAD @CaracolRadio @UltimaHoraBLU @Citytv @rcnradio  @VickyDavilaH @Bocarejo_JP @SectorMovilidad @lafm @NoticiasUno @BiciRegistro_co @BiciRedColombia https://t.co/lJv7sn20UM	  enlavialavida             niunomas   bocarejorenuncie marchar x derecho ala vida y movilidad                   jp          co    
950	1062150226230870017	2018-11-12 20:08:42	mellamoTefa	@NataliaT0903 @Juandedios_P @KimberlyLoaiza_ Gracias❤❤	     página     gracia  
951	1072871011601670150	2018-12-12 10:09:16	CatherineCruzB	Buenos y Bonitos días! Que no se nos quede la sonrisa en la casa hoy https://t.co/SxLAA6dtlI	y bonito   quedar sonrisa casar  
952	1063283434905317376	2018-11-15 23:11:40	Dannys_Pedraza	"""""""""""""""""""""""""""""""El amor cuándo es amor, fluye"""""""""""""""" 👌"""""""""""""""	                amor amor   fluir                 
953	1048355831564177408	2018-10-05 18:34:42	66655520	Acaba de publicar una foto en Bogotá, Colombia https://t.co/sdfBRXpl1M	acabar publicar foto bogotá   colombia  
954	1051226157230768129	2018-10-13 16:40:21	victoriaortega6	@GodoGreen Me duele que seas gay	   doler ser gay
955	1066852589491429376	2018-11-25 19:34:13	TolosaConS	Necesito alguien que vea BIOS de Cerati conmigo :(	necesitar alguien ver bios cerati   
956	1062022548823650304	2018-11-12 11:41:21	Caukaiser	Mejor bajen los cristales o se revientan si el dembow no sale ♫♪	bajar cristal o reventar dembow salir   
957	1066474614652633089	2018-11-24 18:32:16	loveless_11	La única razón es que no sé si sí siga en el colegio y por eso no quiero hablar con ninguna, porque sé que me van a preguntar por eso:( sorry	único razón seguir colegiar y querer hablar   a preguntar    sorry
958	1056692516941168640	2018-10-28 18:41:43	Le_Brun_	De cuerpo entero 👻 https://t.co/Y8F4UsQ6fh	cuerpo enterar    
959	1075592891005845506	2018-12-19 22:25:03	diegmunr	Señores #foxgolcolombia Por qué no le dan una pastilla combo de calmidol-valeriana a @aristigol09 a ver si se calma y se le quita esa manía de gritar para creer que siempre tiene razón.De hecho pocas veces es acertado. Muy pocas. #ElMejorAnalistaSinMicrofono	señor   foxgolcolombia pastilla combar calmidol valeriana a    a calmo y quito manir gritar creer razón acertar      analista microfono
960	1075189847764144128	2018-12-18 19:43:30	ArizaAndrey7	Este año se pasó tan rápido, pero fue de mil emociones, 2018 el año bipolar.	año pasar rápido   mil emocionar        año bipolar
961	1053822048546549760	2018-10-20 20:35:30	nandawithcr7	Estoy muy feliz y amo los pancitos de queso.	feliz y amar pancitos queso
962	1068246494183124994	2018-11-29 15:53:05	danielopez1978	@WRadioColombia Y el rollo del fiscal? Salimos en todos los medios internacionales como un narcoestado y ustedes avivando cortinas de humo	   y rollo fiscal   salir medio internacional narcoestado y avivar cortina humo
963	1055811967707951104	2018-10-26 08:22:43	ANDRESDASTE	@JuanManSantos Profe! Lo llaman.	   profe   llamar
964	1073785999182966784	2018-12-14 22:45:06	__CatalinaF	@SebastianPJ24 Fuerza, Sebastián querido. De todo se sale 🙏🏻	   forzar   sebastián querer   salir   
965	1047813319564972033	2018-10-04 06:38:57	Marroyavejr	Primera penta del mundial... yai https://t.co/TTm7WEsVWO	penta mundial     yai  
966	1055558258780528640	2018-10-25 15:34:34	pmichelsen10	Súper injustos los comentarios de los periodistas de la W encontra de @RappiColombia obvio pueden existir algunas fallas en las compensaciones de los rapitenderos.. pero lo pintan como si fuera q los explotaran y el éxito de esta gran empresa se debería a esa explotación..	súper injusto comentario periodista w encontra    obviar existir fallo compensación rapitenderos    pintar q explotar y éxito empresa deber a explotación  
967	1059959200565092352	2018-11-06 19:02:21	Slamjimmy	@GoteraMorales @EdsonPrez4 @NituPerez @jairbolsonaro @lopezobrador_ Es hilaranteUn factor común de todos los #Comunistas cuando quieren explicar en forma creativa y autodidacta temas económicos y/o las acciones absurdas populistas e improductivas de sus líderesExplicaciones vacías sin contenido real un problema cuando toca debatir sin argumento	            hilarante factor común   comunista querer explicar formar creativo y autodidacta temer económico y o accionar absurdo populista e improductivo líder explicación vacío contener real problema tocar debatir argumentar
968	1061973381900390401	2018-11-12 08:25:59	lberrionorman	@F1 Acción sucia y dudosa de un piloto Mercedes contra Verstapen, no tiene merito el primer puesto de Hamilton.	   acción sucio y dudoso pilotar merced verstapen   merito poner hamilton
969	1062312158774640640	2018-11-13 06:52:10	mmdrvxx	Tócate, Siéntete, conocete a ti misma y ámate tal cual eres, cuando lo hagas tu, el día que conozcas a tu compañero de vida sin duda lo hará, mientras tanto sólo debes preocuparte por ti.	tócate   siéntete   conocete a y ámate   hacer   conocer a compañero vida dudar hacer   deber preocuparte
970	1066808655159468034	2018-11-25 16:39:38	Orleyes	@FacundoBrignolo @Millonariapasti Desde Bogotá le digo que no son sospechas, es una realidad !	     bogotá decir sospechar   realidad  
971	1051586894482563072	2018-10-14 16:33:47	NANACHAGU	Buenísimo este artículo.https://t.co/g3CN0lGn2v	buenísimo artículo  
972	1055214925092700160	2018-10-24 16:50:17	Fecoljuegos	#YaInició la charla de Carlos Múnera, jugador profesional de Cartas y miembro de la Federación Internacional de Póker, quien tratará de responder la pregunta que muchos se hacen sobre si el Póker es un deporte de habilidad o juego de azar? #UnaIndustriaInnovadora https://t.co/wfGZCCjZ9D	  iniciar charlar carlos múnera   jugador profesional carta y miembro federación internacional póker   tratar responder preguntar póker deportar habilidad o jugar azar    industriar innovador  
973	1055817494777212928	2018-10-26 08:44:41	esperanzams1950	@CGurisattiNTN24 Que pereza. Por eso hace meses evitó RCN TV	   pereza   mesar evitar rcn tv
974	1058122461840072704	2018-11-01 17:23:48	hmconsultancy3	Que tengan una Feliz tarde! https://t.co/IhrJHgRBzK	tener feliz   
975	1062421184036421632	2018-11-13 14:05:23	avellalban1	@paoguerreroi @UNESCO Como las ratas de alcantarilla están por todas partes	     rata alcantarillar partir
976	1065460538115846144	2018-11-21 23:22:42	fixmekidrauhl	grupo estoy muy feliz con mi canal en youtube ya se suscribieron????????? https://t.co/Yd2Ta3T5WB ♡	grupo feliz canal youtube suscribir             
977	1048374525384114177	2018-10-05 19:48:59	Engativalcaldia	Al ritmo de gaitas los engativeños han cantado, bailado y disfrutado del Festival de Música Tradicional en la Plaza Fundacional Engativá Pueblo. #FestivalesEngativá2018 https://t.co/hhdyB3anPG	ritmar gaita engativeños cantar   bailar y disfrutar festival músico tradicional plaza fundacional engativá poblar    festival engativá      
978	1059832771181461508	2018-11-06 10:39:58	frafer143	En MedellínRadio Bolivariana,@upbcolombia una de las primeras emisoras universitarias del país, celebra 70 años al aire. Su aniversario coincide con @rcnradio y @CaracolRadio y es una de las primeras emisoras universitarias que se creo en Latinoamerica,después de la @emisoraudea	medellín radiar bolivariano    primero emisora universitario país   celebrar     año aire   aniversario coincidir    y    y primero emisora universitario latinoamerica  
979	1069020826710798338	2018-12-01 19:10:01	LDanielaMSuarez	Somos extraños de nuevo, pero esta vez con recuerdos.	extraño   recuerdo
980	1067471576931729408	2018-11-27 12:33:51	SaraHurtadoF	La vuelta más mamona de mi vida y todo por culpa de @ETBsoluciones 😡😡😡😡	volver mamón vida y culpar       
981	1055324061763620864	2018-10-25 00:03:57	Juan_EspinalR	Presentamos solicitud al Presidente @CamaraColombia con más de 90 firmas de Representantes a la Cámara para concluir el proceso de Moción de Censura, se votará el martes. Gracias a las bancadas que respaldaron al Ministro Carrasquilla @MinHacienda https://t.co/CBGOLl1uzQ	presentar solicitud presidente        firmar representante a cámara concluir procesar moción censurar   votar martes   gracia a bancada respaldar ministro carrasquilla    
982	1061228134660399105	2018-11-10 07:04:38	fgnova1	@PeriodistaEEUU @petrogustavo @CGurisattiNTN24 @HassNassar @AlvaroUribeVel Sigue así , llegarás lejos	              llegar
983	1051340333550845954	2018-10-14 00:14:03	1CamilaC8	Yo no necesito saber si ve o no ve mis redes sociales, no se mate la cabeza por mi si usted está segura de lo que tiene ¿Por que desconfiar? Linda noche Lorena.	necesitar ver o ver redar social   matar cabeza seguro   desconfiar   lindo noche lorena
984	1069404429932265477	2018-12-02 20:34:19	jorgetorresch	La última y nos vamos #balletfolkloricodemexico en Bogotá, Colombia https://t.co/i4utKZjo3n	y   balletfolkloricodemexico bogotá   colombia  
985	1078459363550003200	2018-12-27 20:15:23	MafeCarrascal	@tatiannarive @angelique_niro Igual con el tema de salud tomando de referencia al mismo país.	     niro temer salud tomar referenciar país
986	1073519995383152640	2018-12-14 05:08:06	Rahull357	@ArrancaCo @colombiadeuna Me encanta mi, nuestra Colombia, nuestra gente,los pueblos, el aroma a café, sus amaneces y atardeceres, su música, sus paisajes toditos, su megadiversidad	     encantar   colombia   gente pueblo   aromar a café   amanecer y atardecer   músico   paisaje toditos   megadiversidad
987	1050878144121573379	2018-10-12 17:37:28	falavi2005	@lafemme072 @TatiFierro @CaliSosVos Sí...Yo les critico a los consultores que muchas veces ayudan a elegir a personas bajo engaños y luego dicen que nada tienen que ver con el fracaso	          criticar a consultor ayudar a elegir a personar engaño y fracasar
988	1058489278915854336	2018-11-02 17:41:24	periodistica	Maldita sea, rompieron la primera regla.	maldito   romper reglar
989	1056066727128248320	2018-10-27 01:15:03	arturovargasm	¿No le pueden dar el MVP a Núñez y salimos de eso de una vez? #WorldSeries #Juego3 #smESPN	  mvp a núñez y salir    world serie   jugar    smespn
990	1048613886344290304	2018-10-06 11:40:07	FelipeRosasM	En 10 minutos el United abajo 0-2.	    minuto united abajar     
991	1053071242029395968	2018-10-18 18:52:03	RadNalCo	#AtardecerEnMiCasa “Porrock es una visión musical muy personal, nutrida por músicos de muchas generaciones, algunos que ya han hecho historia, otros que están por hacerla”: @AdrianaLucia https://t.co/MupzSSnwEV	  atardecer casar   porrock visión musical personal   nutrir músico generación   historia   hacerla      
992	1056169215785353217	2018-10-27 08:02:18	_crespaaa_	Ayer me di cuenta que lo que más deseo es que el tiempo se pasé súper lento para poder disfrutar más de mis amigos y del colegio :((	decir desear pasar súper lento disfrutar amigo y colegiar    
993	1059933267661651968	2018-11-06 17:19:18	soymarthagarcia	Sistema financiero ☝️ al 💯 #VivirMejor #MejorandoVidas #befree #lavidaimmunotec https://t.co/nPhy4cIipj	sistema financiero         vivir   mejorar vida   befree   lavidaimmunotec  
994	1054938674767560704	2018-10-23 22:32:34	uillermina	@JERobledo Oiga Robledo lo suyo ya raya en obsesion,cálmese,acepte q está equivocado,sea el señor q creiamos q era,ya q nos tenia engañado,el señor Carrasquilla le da a usted ejemplo de señorio,con tanta canallada suya mire como se comporta.	   oír robledo rayar obsesion cálmese aceptar q equivocar señor q creiamos q q tenia engañar señor carrasquilla a señorio tanto canallada mirar comportar
995	1055305402315915264	2018-10-24 22:49:49	anavale1695	Ya me trata como una parcera, que sad.	parcera   sad
996	1075548651064307712	2018-12-19 19:29:15	VistazoCritico	Este tipo representa el peor riesgo para cualquier sociedad: desfalco del herario público. Que lo mantengan en la carcel	tipo representar riesgo sociedad   desfalcar herario público   mantener carcel
997	1060121939665149954	2018-11-07 05:49:01	AmaneciendoTP	#UstedQuePiensa ¿Le gusta la nueva oficina de pasaportes en el norte de Cali?	  pensar   gustar oficina pasaporte norte cali
998	1049633184097415168	2018-10-09 07:10:26	Anaid_Bta	¿Recuerdas cuando te uniste a Twitter? ¡Yo sí! #MiAniversarioDeTwitter https://t.co/oT0e3APO4t	  recordar unir a twitter       aniversario twitter  
999	1056773169577684992	2018-10-29 00:02:12	elotroalejorop	Mala idea quedarse viendo el conjuro 2... https://t.co/hTfOwtW2jU	malo ideo quedarse ver conjurar       
1000	1061695534497456128	2018-11-11 14:01:55	ebobadilla61	@fdbedout @ClaMoralesM atrevido Hfta. comparar a Macias con Cabello.	     atrever hfta   comparar a macias cabellar
1001	1063844864838778880	2018-11-17 12:22:35	smontoyach	"""""""""""""""@Marmotadorio En este mundo moderno, la """"""""""""""""bodega"""""""""""""""" no es ningún espacio físico en particular... Pero es un hecho que la estrategia electrónica es buena porque imponen tendencia cada vez"""""""""""""""	          mundo moderno            bodega          espaciar físico particular     estrategia electrónico imponer tendencia       
1002	1066117505121423360	2018-11-23 18:53:15	MrApalacios	VAMOS SUELTEN ALGO!!!!!!!!! @Marvel @MarvelStudios @MarvelLATAM #Avengers4	soltar                  avengers
1003	1047431266847653888	2018-10-03 05:20:49	ivanchofg	Muy buenos días ¿café? https://t.co/Kan2l7W5GY	  café   
1004	1073180002018041856	2018-12-13 06:37:05	carlostt2001	Irresponsables Ciclistas, deberían decomisarles la bici por varios meses haber si aprenden https://t.co/JDFTGuRooL	irresponsable ciclista   deber decomisarles bici mesar aprender  
1005	1072874131702599680	2018-12-12 10:21:40	technocio	Convierta su hogar en uno inteligente esta Navidad https://t.co/WkSLoaaunT vía @technocio	convertir hogar inteligente navidad    vía  
1006	1074978620102209536	2018-12-18 05:44:09	jacor01	@natiibedoya @EstebanSantos10 Tome por lambon	     tomar lambon
1007	1065257809049239552	2018-11-21 09:57:07	JohnFALFEREZS	En esta fábula, está Una ilustración, clara, precisa y concisa y mamertos llorando en 3... 2....  1 https://t.co/g7saysUuN7	fábula   ilustración   claro   preciso y conciso y mamertos llorar                
1008	1075768147758596098	2018-12-20 10:01:27	MayaOspina	Que te sube la energía en las mañanas? A mi la música, agradecer, los besos, los abrazos... y algo que me encanta, jugar con bishmilla 😻siempre me pone de muy… https://t.co/Or91tEKLMb	subir energía mañana   a músico   agradecer   beso   abrazo     y encantar   jugar bishmilla   poner   
1009	1069818295233196032	2018-12-03 23:58:52	Alejandrapbr2	Conmigo jamás les va a faltar amor y sexo. En especial sexo.	jamás a faltar amor y sexo   especial sexo
1010	1068003013548109824	2018-11-28 23:45:35	JSMO93	A lo Santa Fe se vive mejor, 🇦🇹 en Centro Comercial Gran Plaza Bosa https://t.co/34I8MofN6W	a santo fe vivir      centrar comercial plaza bosa  
1011	1055646664847953920	2018-10-25 21:25:52	Andres_1409	El arte es un reflejo de la realidad #LatinAMAs  @Telemundo @LatinAMAs	arte reflejar realidad   latinam as     
1012	1074014238207811585	2018-12-15 13:52:03	MrApalacios	El VAR confirma el fuera de juego	var confirmar jugar
1013	1072226656981536772	2018-12-10 15:28:50	anviazca	@Santialarconu @petrogustavo Eres muy buen actor. Es tu derecho opinar. Así que adelante.	     actor   derecho opinar  
1014	1054088083778560002	2018-10-21 14:12:37	OsoPerezoso_	@masanchezvargas @electo_mania También depende de como haya preguntado la encuestadora.	     mania depender preguntar encuestador
1015	1076563023555448833	2018-12-22 14:40:01	angellrive	Trágame tierra y escúpeme en Cabo San Juan-Tayrona 😎	trágame tierra y escúpeme cabo santo juan tayrona  
1016	1063173805965799426	2018-11-15 15:56:02	nvmminyg	CityTV los reporteros que valen la pena ✊✊✊✊	citytv reportero valer penar     
1017	1065312527003893761	2018-11-21 13:34:33	luisfelipesalc6	#EstoyConCeciliaOrozco acá ya sabemos quienes son los yahmures, los rugeles y demás frutas podridas	  cecilia orozco acá yahmures   rugeles y fruto podrir
1018	1058501898997776384	2018-11-02 18:31:33	GIAndradeP	Felicitaciones. Muy merecido. @carlosfonzeca	felicitación   merecer   
1019	1064644947666706438	2018-11-19 17:21:50	aureliobabiloni	@WRadioColombia Peláez? Usted en esas...	   peláez     
1020	1049726559681167363	2018-10-09 13:21:29	MarianaPardoV26	Amo🤓❤️ (@ Havas Media in Bogotá, Distrito Capital) https://t.co/BBoN8USQDS https://t.co/vIKYPK0msM	amar        havas medio in bogotá   distrito capital     
1021	1076683302998814720	2018-12-22 22:37:57	paulasocadagui	Vero es tan tierna, la amo tanto. @vero_mejia223 https://t.co/tlB14KtwaY	vero tierno   amar     mejia     
1022	1061413679470731265	2018-11-10 19:21:55	gaprietorico	@FiscaliaCol , @PGN_COL , @CGR_Colombia ¿porqué tratar con guante de seda a los políticos ladrones, si son ellos los responsables de la permanente alteración del orden público en el país?.Sugiero una arremetida de los órganos de control contra todo tipo de corrupción.	       col      colombia   porqué tratar guante sedar a político ladrón   responsable permanente alteración orden público país   sugerir arremeter órgano control tipo corrupción
1023	1074734096776073216	2018-12-17 13:32:30	La__Marta	El mejor capítulo por la eternidad 😍	capítulo eternidad  
1024	1078435390216945664	2018-12-27 18:40:08	bautista_yair	@HOLLMANMORRIS @petrogustavo Con una capacidad de ejecución 0	     capacidad ejecución  
1025	1053433795922350082	2018-10-19 18:52:43	erodriguezngl	@ContraloriaBta les puedo decir q de ver a TGI SA ESP haciendo los superpapelones de contratos corruptos , me indica q ustedes solo comulgan con la corrupción	   q a tgi sa esp superpapelones contrato corrupto    indicar q comulgar corrupción
1026	1072639099515875328	2018-12-11 18:47:44	CesarMorenoH	ratas vivas y sueltas en el congreso.... cual es la noticia?	rata vivo y suelto congreso      noticiar
1027	1075822953307258881	2018-12-20 13:39:14	julian_ortegam_	@cforeroo @Patton Hágale caso a @cforeroo. Esas Imusa son guerreras.	     hágale casar a     imusa guerrero
1028	1060305008690913288	2018-11-07 17:56:28	KaEstepa	Creo que siempre la voy a extrañar 😞.	a extrañar   
1029	1056256935270473728	2018-10-27 13:50:52	ctrejosmd	Turno 18 (@ Clínica Federmán in Bogotá, Distrito Capital) https://t.co/xjsUhqTkEG	turnar        clínico federmán in bogotá   distrito capital   
1030	1058877494135324678	2018-11-03 19:24:02	MissBalli	En algùn momento pensè que saco fucsia + tenis fucsias + pantalòn negro era too much y me abstuve.OBVIO saco fucsia + tenis fucsias + pantalòn militar me parece perfecto! 🙆🏽‍♀️..Es… https://t.co/gQLkeLP604	algùn pensè sacar fucsia    tenis fucsia    pantalòn negro toar much y abstener obviar sacar fucsia    tenis fucsia    pantalòn militar perfecto            
1031	1063183824119586818	2018-11-15 16:35:51	jdanieljara	A los muchachos que andan por la 106, la policia está rodeando el parque #ManifestaciónPacífica #MarchaPorLaEducación #MarchasSinEncapuchados https://t.co/1i7RuMHNSa	a muchacho andar       policia rodear parque   manifestación pacífico   marchar educación   marchar encapuchar  
1032	1060260224261591040	2018-11-07 14:58:30	AlejoGonzalezPe	Menos mal fue Maluma y no Shakira.	maluma y shakira
1033	1068097943297609729	2018-11-29 06:02:48	_fransua	Capacitan a 37 taxistas de #Calico para prestar un servicio de calidad con las mujeres. La situación se origina porque muchos conductores son groseros y hasta morbosos con las pasajeras #ValleDelCauca https://t.co/wfAbG6f530	capacitar a     taxista   calico prestar servicio calidad mujer   situación originar conductor grosero y morboso pasajero   vallar cauca  
1034	1049394531383304194	2018-10-08 15:22:07	andrescruz14	Esta quincena lo que no me tomé en cerveza me lo tome en Antigripales 😒	quincena tomar cerveza tomar antigripales  
1035	1051621413289906176	2018-10-14 18:50:57	gatica1119	Acaba de publicar una foto en Funza https://t.co/dKM8CZgmu6	acabar publicar foto funza  
1036	1058378021692944385	2018-11-02 10:19:18	iLorrein	@NatyAgudelo8 -Ya estoy averiguando.Tu qué fechas?	    averiguar fecho
1037	1051299106289852419	2018-10-13 21:30:13	gon_olive	@OrozcoJr1 @MabelLaraNews Si como no? Mejor eso es lo que dice la prensa de los mendigos arrodillados latinos.	       prensar mendigo arrodillar latino
1038	1062908970430541825	2018-11-14 22:23:41	myrdur	.@MikeSelector llamada de un paramilitar uribista al fiscal de Colombia implicado en corrupción Odebrecht ..Apenas  es el inicio de cómo se va desenredando  la turbia y mortal madeja  @CIDH	    llamar paramilitar uribista fiscal colombia implicar corrupción odebrecht      iniciar desenredar   turbio y mortal madeja   
1039	1051613088204693505	2018-10-14 18:17:52	Motheerfucker	Estoy muy ebria para que me hagan ver la vida de una manera positiva.	ebrio hacer vida positivo
1040	1072981539074514945	2018-12-12 17:28:28	gabodelascasas	@lolitamaldita @paniagua @JoseCarlosTecno Estar con dos santafereños es preocupante	       santafereños preocupante
1041	1054882586391203842	2018-10-23 18:49:42	ErnestoUsma	Felicitaciones a @NelsonRemolina a buena hora la SIC con un delegado con todo el conocimiento. Felicidades profesor.	felicitación a    a hora sic delegar conocimiento   felicidad profesor
1042	1051133529470439424	2018-10-13 10:32:17	LuisAlf82940568	"""""""""""""""@NoticiasCaracol ESTOS MALPARIDOS TERRORISTAS DE LA CORRUPCIÓN CON LA POLÍTICA DEL"""""""""""""""" COSQUILLEO"""""""""""""""" LE """"""""""""""""ESCAMOTEAN"""""""""""""""" AL ERARIO 52 BILLONES DE PESOS ANUALES QUE ALCANZARÍAN PARA HACER DE NUESTRAS UNIVERSIDADES UN EMPORIO DEL CONOCIMIENTO DE EXCELENTES CALIDADES https://t.co/huSD3umzS1"""""""""""""""	          malparir terrorista corrupción político          cosquillear                   escamotear          erario     billón peso anual alcanzar universidad emporio conocimiento excelente calidad  
1043	1061854584904261632	2018-11-12 00:33:56	HumoCardenal8	Haga silencio Alfredo.	hacer silenciar alfredo
1044	1074385123213225989	2018-12-16 14:25:49	jfgartner007	Los pedacitos que faltan https://t.co/XNT3nSDETg via @RevistaSemana	pedacitos faltar    via  
1045	1050390008329396225	2018-10-11 09:17:47	LucianaMora10	@DanielSanin Porque si pagan educación no les alcanza para drogarsen	   pagar educación alcanzar drogarsen
1046	1053693844267692032	2018-10-20 12:06:03	alfmilf	@MelissaDelahoz Está segura ? No creo , no generalice	   seguro       generalizar
1047	1055645139094396928	2018-10-25 21:19:48	pacozhaono1	Como agente de compras en Yiwu https://t.co/RswSbvzjVj(En China wechat mejor) #español #barcelona #mexico #lima #medellin #madrid #saopaulo #honduras #ecuador #spain… https://t.co/jBeZrxyqrU	agente comprar yiwu    chino wechat    español   barcelona   mexico   limar   medellin   madrid   saopaulo   hondura   ecuador   spain   
1048	1056167577305710592	2018-10-27 07:55:47	Edwindanilosonz	@JBotanicoBogota Tecnología convergente, seguridad y combatir la competencia desleal de #UBER deben ser la base del acuerdo entre taxistas y @Bogota por el bien de los usuarios y de la calidad del servicio de taxi @7MarcoFidelR https://t.co/BpViZxpnez	   tecnología convergente   seguridad y combatir competencia desleal   uber basar taxista y    usuario y calidad servicio taxi    
1049	1075195130590752768	2018-12-18 20:04:29	Namileal	Dios ayuda por favor	dios ayudar favor
1050	1061837547826016256	2018-11-11 23:26:14	Omitar69	@ElColeccioniste Me encanta cuando te las das de adivinó...dame el número del baloto...	   encantar dar adivinar    dame número balotar   
1051	1066517212800921600	2018-11-24 21:21:33	CarlosuNieto	Ya se cansaron de robar las tierras productivas y ahora se van a robar diez mil aspirantes a estudiar en una sola universidad?? @ClaudiaLopez @AntanasMockus @sergiofajardo	cansar robar tierra productivo y a robar diez mil aspirante a estudiar universidad        
1052	1058027223414910978	2018-11-01 11:05:21	tufuturo_com	🏡SE VENDE HERMOSA CASA UBICADA EN CIUDAD BERNA DE 2 NIVELES 620 MILLONES NEGOCIABLES INFO 📲3144908704 🔘ÁREA DE 9.5 X 20🔘COCINA INTEGRAL AMPLÍA 🔘SALA COMEDOR AMPLÍA 🔘PARQUEADERO 3… https://t.co/icoGoZjSRu	  vender hermoso casar ubicar ciudad berna    nivelar      millón negociable info               área      x     cocinar integral ampliar   salar comedor ampliar   parqueadero     
1053	1075437314632048641	2018-12-19 12:06:51	jtobiexe	@jorgerojas_co @LeonFredyM @BettyZorro @ComVIcamara @PartidoVerdeCoL @CamaraColombia @elespectador @Teleantioquia @rcnradio @PCambioRadical Obvio, el castigo sí, pero ambos son ladrones.	   co                    obviar   castigar   ladrón
1054	1076689146142474241	2018-12-22 23:01:11	_LaFonseca	Soy tan impaciente que puse a hacer unos huevos duros y me tocó comérmelos tibios porque hambrienta 24/7.	impacientar poner a huevo duro y tocar comérmelos tibio hambriento      
1055	1050315160957710336	2018-10-11 04:20:22	ivanchofg	@ArkhamKOU Yo si lo digo en serio 😔	   decir seriar  
1056	1074795909517590530	2018-12-17 17:38:08	alejo1827	Mi momento más memorable de este año fue… #FelizAñoNuevo #Recuerdos2018 #teparatres #suiti súper dream team.  Viste. https://t.co/ASiNcJ1pvu	memorable año    felizaño   recuerdo       teparatres   suiti súper dream team    vestir   
