	id_tweet	created_at	user_name	text
20274	1049982158960558081	2018-10-10 06:17:09	acostajaime	Una propuesta muy racional por lo tanto la acompaño. Apoyo marcha de hoy de los estudiantes en toda Colombia. https://t.co/dRSXc4tBZS
20536	1058913357942714368	2018-11-03 21:46:32	alejopijao94	@mimamadecia @manolitosalazar @TransMilenio Ve que raro me sorprende que está mal informada por qué recientemente en Santiago de chile estranaron más de 100 buses eléctricos para la empresa Transantiago y en Medellín ya está en adjudicación de buses eléctricos del metro plus.
20539	1050079293336944641	2018-10-10 12:43:07	alejopijao94	@Violencio_Rivas Tal así que por vago no pude ir a la marcha y ese día de marchas ese SENA era un cementerio.
20565	1046740002674286593	2018-10-01 07:33:58	alexfrancogomez	@TransMilenio cuando piensan acabar con los vendedores ambulantes y cantantes que ahora asistan el sistema?
20570	1063454960095059968	2018-11-16 10:33:15	alexgomezest	Cinco infiltrados de la policía en la marcha estudiantil en Bogotá - Las2orillas https://t.co/53ZsAmIoqS
20576	1063620144755294208	2018-11-16 21:29:38	alexis_valero	@jcamilocl @fedecarpa @fdbedout @IvanDuque Por el hueco fiscal que dejó el gbno Uribe?
20647	1071449034219511810	2018-12-08 11:58:50	alsidero	@EnriquePenalosa y sus amigos en la @Bogota todos Picaros, Corruptos, Ladrones.....https://t.co/FkI56z4PY0
40844	1052926939667857408	2018-10-18 09:18:39	amartiu	@WRadioColombia Por supuesto que sí y además cumplir con todas las normas del tránsito de automotores y respetar al de a pié.
20775	1071576804626960385	2018-12-08 20:26:33	ancnz_	y cerca de donde estaban lanzando pólvora había una revuelta en transmilenio. https://t.co/3Dvb3kOw7n
20778	1048677590884655104	2018-10-06 15:53:15	andersonferlord	@retrino @TransMilenio @Jennyferpbn por favor 0 escándalos jajajajajaja
20945	1050093393546805248	2018-10-10 13:39:09	andresvegaceet	@Bogota @EnriquePenalosa @EnriquePenalosa no habla #ConLaVerdad , muchos estamos cansados que experimenté con Bogotá, @TransMilenio  no es la solución, metro elevado como lo plantea tampoco.
20961	1067558517387788288	2018-11-27 18:19:19	andrexramirez	¡Prepárese! Así será la jornada de marchas este miércoles https://t.co/BLyTFmhGMO
21237	1059790071757500417	2018-11-06 07:50:17	ashima7	@juaneslewin Y el mal llamado SITP provisional? Cuya salida acaba de prorrogarse por un año más. El alargue del alargue del transporte público colectivo tradicional, con todas las falencias de un esquema con escaso control.
21246	1071901417886105602	2018-12-09 17:56:27	astrosvd	Esto ya va a comenzar !!!   El último capítulo del año de #YongaritmoYLosPolinomios https://t.co/jToxRy4v8Z @yongaritmo @UNTelevision @VRI_UN @DIEB_UN @FCienciasUNALco @datorresg1977 @Extension_UN @TiempodeCiencia @TodoEsCienciaCo @TransMilenio
40916	1047512308698759168	2018-10-03 10:42:50	augustodocente	@SectorMovilidad @Bocarejo_JP Esperamos que la movilidad se mejore en estas vías pues los trancones son enormes, los policías de tránsito solamente estan pendientes del pico y placa, los semáforos se dañan continuamente y los recorridos son de horas.  Entonces secretario trabaje por una mejor movilidad
21395	1062504334242603011	2018-11-13 19:35:48	beridhrensw	@TransMilenio Mk a mi me emputa tanto que avisen estas mierdas como media hora después.
35844	1062454020646846464	2018-11-13 16:15:52	bersogar	@PoliciaBogota @Alcaldiakennedy @Citytv Alerta.Se ubican ladrones con arma blanca en puente peatonal entre estación mandalay y banderas de @TransMilenio
21455	1075082240248418305	2018-12-18 12:35:54	blancaduranh	@AlixiaLesmes Acá en Ibagué van a poner una pista de hielo, se imaginan? una pista de hielo debe gastar muchísima energía en una ciudad con una temperatura de 30 grados
21473	1058558628838498304	2018-11-02 22:16:58	bogota_social	@EnriquePenalosa  adjudicó licitación  para comprar  1.143  buses contaminantes para  @Transmilenio:*El 59,7%= 682 buses tipo volvo diesel euro V; * 40,3% = 461 buses,  para skania, gas, euro VI. *Eléctricos= 0,0%.  Tecnologías rechazadas en todo el mundo por ser  obsoletas. https://t.co/xz1Tvc8y7B
21490	1073352404047929345	2018-12-13 18:02:09	bogotaampm	#Editorial @TransMilenio por la Carrera Séptima: Dudas y preguntas luego de abrirse licitación para su construcción #RadioRed970AM #RCNRadio https://t.co/vIoTi8cTFZ
21566	1069979913967550464	2018-12-04 10:41:05	bogotacity	.#Bogota: Así funcionará TransMilenio en diciembre https://t.co/JAGWklbpPU #BogotaCity #Movilidad
21638	1052631743889633280	2018-10-17 13:45:39	bravoamezquita	@salexbecerra_97 A ver Becerra, ¿cuál es tu problema? ¿muchos problemas de temperatura? 🧐
21658	1062872964192972801	2018-11-14 20:00:36	bsmbcol	Hahahaha Transmilenio es horriblemente bello. Patrimonio material, histórico y de memoria para varias generaciones colombianas. De la Capital de la República para el mundo. https://t.co/BZEYzMWRfi
21708	1069850591847964673	2018-12-04 02:07:12	calderonrichi	#UnDíaComoHoy4 de diciembre de 2000En Bogotá se inaugura el Sistema de transporte público TransMilenio, con buses articulados y carriles exclusivos en vías troncales. https://t.co/30KnFY3UvJ https://t.co/tiugM7biVW
21739	1060304351372234752	2018-11-07 17:53:51	cam4076056	@Pao_Sinisterra @TransMilenio @CulturaenBta @sitpbogota @CanalCapital @EnriquePenalosa @integracionbta @Bogota @SectorMovilidad @BogotaTransito @idubogota @SeguridadBOG Sí, los servicios de Aguas ahora se detienen allí como el F23 y el B74
21785	1048300999318933506	2018-10-05 14:56:49	camiloandres74	@AlvaroUribeVel Convoque la marcha Presidente yo lo sigo...
21790	1060678550322376704	2018-11-08 18:40:47	camilogonzlz	@RolaVendeHumo De acuerdo! mi hermana camina desde hace más de 2 horas desde La Tadeo y hace un momento dice que por la 80 no pasa un solo bus... todo el mundo caminando. @TransMilenio
21837	1055096622437273600	2018-10-24 09:00:12	capitano1989	La participación de @TransMilenio en el simulacro es mostrarnos como no va a haber servido en caso de un terremoto @TransMiseria
21892	1073057307381116928	2018-12-12 22:29:33	carlitosbolanos	@JuanSQ1 @TransMilenio Correcto, la ciudad se debe mover como un todo es decir, metro, Transmilenio ,alimentadores, metro cable, tranvía, trenes y si es posible trasporte marítimo pero hay que avanzar coherentemente priorizando los problemas de masas ej. China, lo se porque lo vi, como Medellín por ej.
35879	1059093105264283654	2018-11-04 09:40:47	carmuzo	@lfafanador @TransMilenio @EnriquePenalosa @NoTM7a Otra cosa piensa el presidente de Chile, mire este vídeo corto acerca de la renovación de la flota de Trans-Santiago con 200 buses eléctricos de BUS China y 400 y pico buses Euro VIhttps://t.co/xv9CiCUpl3
21991	1059101421906337794	2018-11-04 10:13:50	carolmonroy_	Siempre pensé que los buses alimentadores de Transmilenio eran lo más demorado en el mundo... Al cabo de unos días descubrí que el bus más demorado del mundo es el que yo este esperando 😥 #TransportePublicoEnMiCiudad
22011	1059183428552269824	2018-11-04 15:39:42	casallas1000	@NoticiasCaracol que hueco ni que hueco , simplemente duque le tiene bronca a la clase media y nos va a pone a pagar el iva a todos los alimentos de primera necesidad ,  ponga a contribuir a las iglesias  cristianas , cuyos pastores viven como reyes ...........
22050	1063177364430114816	2018-11-15 16:10:11	cathenavarro	@TransMilenio @EnriquePenalosa @BogotaTransito @SectorMovilidad @CanalCapital @Bocarejo_JP @rutassitp @SeguridadBOG @YesidLancheros @JGarciaG1 Novedades porfa?
22055	1057580459532738561	2018-10-31 05:30:05	caycedo	@FlanaganDJ @Otra_Licenciada Aunque Melbourne tiene mejor clima que Amsterdam, curiosamente se hacen menos viajes en cicla al día allá abajo. La causa es que obligan a usar casco.
22081	1048566413860978688	2018-10-06 08:31:29	cbadelhugo	Madrugué a lavar ropa con una amigo en la casa comunitaria de la lavada de ropa, el clima estaba re peye, el man puso sistema solar y salió severo sol. Solo felicidad para este anciano.
22132	1065708194561970176	2018-11-22 15:46:48	cerb71	@idubogota @Bogota @GobiernoBTA @IDTBogota @Bocarejo_JP @sgeneralbogota @TransMilenio @CanalCapital @SectorMovilidad @UMVbogota @EnriquePenalosa solamente LLOVIO DURANTE UN HORA Y 15 MINUTOS MÁXIMO...NO ENGAÑEN A LA GENTE.
22144	1060992147846057985	2018-11-09 15:26:54	cesar44817	@NoticiasRCN @TransMilenio @jarithmo La demanda contra los lideres de la protesta ya estara lista
41064	1069780240954781696	2018-12-03 21:27:39	cesaralo	Según el Foro Económico Mundial, una persona de 78 años, duerme 25 años, se gasta 19 años viendo pantallas y publicidad, 6 años en el tráfico y 17 años trabajando. Le quedan 11 años para lo demás. En sexo (2 por semana) invierte solo 30 días. Pilas muchachos 💥
22176	1053288844102111232	2018-10-19 09:16:44	cesarsep1974	@NoticiasCaracol Quisiera ver al flamante alcalde movilizándose en transmilenio todos los días.
22262	1066207178644697088	2018-11-24 00:49:35	chelo1215	Eso parece concejal @Juan_Florez, el flamante alcalde @EnriquePenalosa vuelve y juega, en su 1era alcaldía nos hizo conejo imponiendo su detestable @TransMilenio, otra vez conejo, privilegiando a un sólo oferente,  no hay derecho con Bogotá, puro serrucho, esa plática se perderá. https://t.co/nxh4ikNJ0G
22465	1056576375333756930	2018-10-28 11:00:12	confidencialcol	Muere el dueño del Leicester en un accidente de helicóptero a las afueras del estadio https://t.co/rdQUmmerfn
22481	1070317971694936070	2018-12-05 09:04:24	corficolombiana	"""""""""""""""Nuestro economista jefe @JulioCRomeroA comenta que """"""""""""""""se evidencia un repunte de la economía colombiana que, aunque lento, ya marca un cambio de tendencia después del fuerte choque de materias primas de 2014"""""""""""""""". https://t.co/ADFmV2ILQP"""""""""""""""
41134	1055589776643014656	2018-10-25 17:39:49	cosmomimes	Charla enfocada a destacar las diferencias evolutivas, anatómicas, dietarias y comportamentales existentes entre los osos y los perezosos. Además de alertar sobre la relación preconciente entre la palabra oso-peluche y mascota, para prevenir el tráfico de perezosos. https://t.co/hPmOzO9gt5
22548	1065692733841510401	2018-11-22 14:45:22	cristianc_y	@BluRadioCo @AlvaroUribeVel Sí hubieran reducido el congreso y el sueldo de congreso y si devolvieran la plata de isagem, AGROINGRESO, OBREDETH, reficar, vías 4G, túnel de la línea, Panamá papers, tendríamos los recursos para educación y el hueco fiscal.
22668	1051809997976420352	2018-10-15 07:20:19	danielaavila_	No se imaginan que es caminar casi por una hora, a las 4 de la mañana, y en una temperatura de 5 grados ❄️😴
22717	1072994084640428032	2018-12-12 18:18:19	danielbernalb	El grave problema de la pésima #CalidadDelAire reportado en estación subterránea @TransMilenio Museo Nacional, que parece cámara de gases 😷, se repetirá en #LaNuevaSeptima pues tendrá varias subte sr @EnriquePenalosa @Bocarejo_JP ¿o aquí sí les servirán los eléctricos? https://t.co/wR9O6nYcKy
41165	1076159774100779008	2018-12-21 11:57:38	danielfpolania	En Austria los ratones se comen las cuerdas del órgano dela iglesia, lo que impide que haya música en la misa de #navidad, la tristeza que le produjo el incidente al cura lo llena de inspiración para componer unacanción que se cante con el sonido de la voz, nacerá Noche Paz. https://t.co/QQ3VpzpaEL
22902	1049685162601209863	2018-10-09 10:36:59	deespacio	"""""""""""""""Muchas gracias @TranspGenderLab y @elespectador por el reconocimiento a nuestra actividad """"""""""""""""Que tu acoso no nos toque"""""""""""""""" que hace parte de una campaña mucho más grande que busca recuperar la cultura ciudadana en @TransMilenio https://t.co/7I3ubnRh2F"""""""""""""""
35918	1047845930282758145	2018-10-04 08:48:32	destroucs	salí a afrontar el día con toda la actitud positiva y una cucha hizo que se me quedara atrapada la maleta en la puerta del sitp https://t.co/Bx3yluhmWd
22950	1057623288174821377	2018-10-31 08:20:16	destroucs	Quiero disfrazar mi cuello de marcas de neumático de sitp.
23007	1063253233454374912	2018-11-15 21:11:39	dhidalgo65	@katzenschaeler @EspinosaRadio @dw_espanol @Bogota @TransMilenio Yo no veo problema en subsidiar la trancisión a cero emisiones de tubo de escapeEs una inversión social efectiva Debe existir un marco para ello, con apoyo Nacional (como en Chile o en China)Si veo problema en cuota que preselecciona a un solo proponente interesado
41220	1047149277330460673	2018-10-02 10:40:17	dhidalgo65	.@Bogota sigue disminuyendo el número de muertes en el tráfico (4%  enero-agosto 2018 respecto al mismo periodo de 2017)Importante reducción en peatones Estabilidad en motociclistas @Bocarejo_JP Segumos reforzando #VisiónCeroBOG, gestión de velocidad https://t.co/gEVeESGXrc
41251	1053988162157076480	2018-10-21 07:35:34	didiervdh	@saludhernandezm En los años 20's perdieron la vida centenares de agentes, controlando la fabricación y el tráfico ilegal del alcohol. Hoy ya no se mueren.
23141	1046762579585060869	2018-10-01 09:03:41	diegoakvargas	"""""""""""""""""""""""""""""""Chile en 2016 tenía cerca de 12 muertes por cada 100 mil habitantes por tránsito, en la región estábamos bien, frente a la OCDE estábamos bien MAL, éramos el peor país, lejos de Suecia con 2,8 muertes por cada 100 mil habitantes"""""""""""""""" @PaolaTapiaSalas exMinistra de Transportes"""""""""""""""
23142	1075761038388273153	2018-12-20 09:33:12	diegoamayav	@idubogota @UMVbogota @Bocarejo_JP @EnriquePenalosa Sería importante que se reparará la junta de Dilatación del puente vehicular de la Cl 80 ir Av Boyacá es una vergüenza tener que soportar este hueco que genera grandes trancones sobre la cl80.Señores donde esta la supervicion
23156	1050024032681234432	2018-10-10 09:03:32	diegobta0	@gaitan_presente @HOLLMANMORRIS Mas grande que reficar... uy ese bobo litro del peñalosa quiere dejar a los bogotanos en la quiebra, no le basta su transmilenio tan malo y caro. @EnriquePenalosa usted es el cáncer de bogota anciano
23181	1057303669580988416	2018-10-30 11:10:13	diegoguitar1	@ovalle2707 @Juan_Florez @TransMilenio @ECOPETROL_SA Hay muchas alternativas,  buses eléctricos por ejemplo.  El problema es que Peñalosa quiere que sea euro v para que gane volvo la licitación.  Aquí hay un claro problema de conflicto de intereses.
23184	1052568876657991682	2018-10-17 09:35:50	diegokarachas	@dhidalgo65 @ClaudiaLopez @MetroBogota Hola Darío, pero en ese entonces pensaban que salía más barato, no era claro que no iba a quedar independiente de TransMilenio y además que tendría estaciones más alejadas y con una menor capacidad, si hay envidia con Quito.
23208	1072553004467961862	2018-12-11 13:05:37	dilialucia	Jajaja tras de cotudo con paperas ¿Qué hizo por que hubieran buses eléctricos en la licitación de Transmilenio? Nada. Antes le salimos a agradecer un proyecto para el 2040. Descarado! https://t.co/eMRQdq0XWP
23270	1050847180561498112	2018-10-12 15:34:26	donborji	- Dicen dizque Petro se apropió de la marcha estudiantil.- Ni idea. Ese día estaba muy ocupado y no vi.- Pero usted qué opina?- Nada porque me acabo de enterar.- Ese importaculismo suyo.- Ok. Yo también creo que se la apropió. Contento?- Cómo va a decir eso?*Así son. 😒
23306	1046764647116951553	2018-10-01 09:11:54	dpazmino	#lamadre para esos usuarios de @TransMilenio que cuando llevan morral no lo ponen en la parte de adelante y hacen estorbo #BogotáHumana
23313	1073764551248830464	2018-12-14 21:19:53	drborrego21	No más atropello contra el gremio médico, no más amarillismo, no más sucio en la vida de una excelente persona y profesión al de la salud #yoapoyoalDrSancez
23329	1051633285472931840	2018-10-14 19:38:08	ducu__u	Me contaron que el pelado que sobrevivió al accidente del Volkswagen quedó frito llaves. Que le preguntaban que si iba a ir al funeral de las hermanas y contestaba que de qué hablaban,que ellas estaban vivas. Que en la madrugada se despertaba gritando LAS MATÉ y volvía a dormirse
23355	1073191889120186369	2018-12-13 07:24:19	eClipssi	Las imágenes aéreas grabadas con un dron muestran un amasijo de hierro y escombros con al menos 9 muertos.https://t.co/RYOIOV2GFa Via PlayGrounder https://t.co/esN6PrVc8v
23379	1061971712164745217	2018-11-12 08:19:21	ecoglobal_expe	¡Lluvia de estrellas en los Llanos Orientales con Ecoglobal Expeditions! - https://t.co/ud7StkA0yT
23409	1050512239424200704	2018-10-11 17:23:30	edgarAmontenegr	@losoriginales @jaimesancristo @udsnoexisten la semana pasada en el bus que iba se subio un colombiano a vender me parecio curioso porque al transmilenio solo se suben venezolanos a vender ultimamente
23436	1065670484476510208	2018-11-22 13:16:57	edgarrolarte	@neutrallogic @Angela___06 @JairGiraldo25 @IndomableLeon @ingeniero0013 Pero si el genio que se dice ser ambientalista no renovó los buses y extendió su vida útil por más años, le agradecemos? ptb por el SITP provisional con buses viejos? o por el incremento del mototaxismo?
23497	1067940823604621312	2018-11-28 19:38:28	edidiazm	@TransMilenio Jajaja y ustede todos los días se demoran en enviar los buces y una frecuencias pésimas y uno bien cansado queriendo llegar a casa
23547	1057685366487072769	2018-10-31 12:26:56	eduardobula25	@tuitteroxeneize @mavegol @m_benedetto La protesta sobre el resultado del partido se basa en el artículo 56 que sostiene que se modificará por A) Alineación indebida, B) Supuestos de corrupción arbitral C) Incidente grave que haya tenido incidencia. Esto último es lo que reclamará Gremio.
23559	1076917201809088515	2018-12-23 14:07:23	edwardalarcon3	@JUANVIALPARRA @SectorMovilidad @Bocarejo_JP @alcaldiausaquen @usaquenET @CanalCapital @Bogota @idubogota @UMVbogota @dhidalgo65 Un accidente Asesino culpable ?
23570	1065608842015313922	2018-11-22 09:12:00	edwes_	O sea que piensan que cuando estos niños crezcan todavía vamos a tener TM. JAJAJAJAJA ¿Algún día Bogotá va a evolucionar? https://t.co/TbIVyEwkmB
41325	1057979131504271365	2018-11-01 07:54:15	edwin_outlook	@darey1976 @NoticiasCaracol Lo que quiere es sacar más impuesto y cosas para los motociclistas peaje ect pero nesecita una excusa yo veo todos los días accidente de carros fantasmas y los malos son los de las motos
23660	1055190840371539968	2018-10-24 15:14:35	eldementiras	Y si se evacúa el lugar por que hijueputas en la última foto está tan cerca el camarógrafo de la bomba y el robotcito.No señooooor. https://t.co/qMWP48KD2G
23982	1071245482481991682	2018-12-07 22:30:00	elespectador	Libre hombre señalado de empujar a joven a carril de Transmilenio. https://t.co/zFQnxGkTJL https://t.co/fsRXU38orh
24073	1062278904772055041	2018-11-13 04:40:01	elespectador	La temperatura en los Pirineos ha aumentado un 30% más que la media mundial.https://t.co/PsM9Iys84F https://t.co/vTb8zbdfcR
23919	1048089400507162624	2018-10-05 00:56:00	elespectador	La explícita manifestación de un grupo activista en Cali por el Día Mundial de los Animales.https://t.co/Bxia6e4m7e https://t.co/U13M98lrvF
24050	1076177706407084037	2018-12-21 13:08:54	elespectador	Portal Américas de Transmilenio tendrá 260 biarticulados a gas. https://t.co/n0G7Rw80xu https://t.co/UGxACEFFTE
24057	1053946494557061120	2018-10-21 04:50:00	elespectador	Presidente Duque rindió homenaje a militares muertos en accidente aéreo.https://t.co/bqBhaUGqET https://t.co/DWIkI6NdMF
23774	1067753472223698944	2018-11-28 07:14:00	elespectador	¡Tome precauciones! Estas son las rutas de las marchas de mañana en Bogotá. https://t.co/hSChEoSdSQ https://t.co/GlTJHnzkSS
41337	1063547257012846594	2018-11-16 16:40:00	elespectador	#EnContexto “El Chapo” Guzmán es acusado de liderar entre 1989 y 2014 el cartel de Sinaloa, al que fundó y convirtió en la mayor organización de tráfico de droga del mundo. https://t.co/4FVUUuPImr
35986	1074675075050336256	2018-12-17 09:37:59	elespectador	Ingenieros de la U. Nacional crean sistema que determina la eficiencia de buses del SITP. https://t.co/U0ha6rK83q https://t.co/KwFmrWM4Bx
23990	1054131463585583104	2018-10-21 17:05:00	elespectador	Listos prepliegos para licitación de Transmilenio por la Séptima. https://t.co/E19PjghK1H https://t.co/vh8E7jLXJJ
23991	1054161662700208130	2018-10-21 19:05:00	elespectador	Listos prepliegos para licitación de Transmilenio por la Séptima. https://t.co/E19PjghK1H https://t.co/Ev35kDEXTU
23704	1057374080062705664	2018-10-30 15:50:00	elespectador	#HagamosMemoria  Si hay una costumbre bien colombiana y que gusta mucho en la política es la de cambiar las reglas de juego sobre la marcha. Hablemos de alargar el periodo de alcaldes y gobernadores. https://t.co/WTjwvkzff8 https://t.co/5sux5l5JGl
23872	1057150103813681154	2018-10-30 01:00:00	elespectador	El choque entre Petro y el uribismo por el cartel de Medellín.https://t.co/9aIhtPnVOJ https://t.co/2kXvhNa4zd
24128	1060735197677793280	2018-11-08 22:25:53	elimprudenteCO	@NicoDuRo @patriotaamigo @EfectoMajo @freddy20ardila @JoseCuelloB @linamcardonag Entonces justificas poner en peligro al conductor y su porpiedad? Atropello a dos personas, destrocemos el panorámico....
24150	1073400764075311104	2018-12-13 21:14:19	elpalabrista	Las carpas pasando el paso nivel detienen a los ciclistas, están regalando algo, y edtos invadieron carril de @transmilenio. No hay ni un auxiliar bachiller ni un guardián de ciclovía. Av Eldorado frente a gran estación https://t.co/6gq1w6qIZS
24212	1058535458345488385	2018-11-02 20:44:54	emilianogarcia	@manolitosalazar @TransMilenio Quiénes son los ganadores? Empresarios nuevos o los mismos de siempre?
24254	1058672791820685312	2018-11-03 05:50:37	eriavila1	@ernestomaciast Dónde está el estatuto anticorrupción que se comprometieron a pasar después de mandato de casi 12 millones de colombianos en la consulta? Las reformas tributarias de Santos en su momento fueron hechas para tapar el enorme hueco que dejó Uribe. La historia se repite, no es  nueva.
24538	1074349913968787456	2018-12-16 12:05:54	erosyafrodita6	Llena por todos los huecos  Video Completo en https://t.co/Sl2owN4L1w https://t.co/afwZSv4mRw
24492	1048030725688053760	2018-10-04 21:02:51	erosyafrodita6	que hueco tan tragon de vergas Video Completo en https://t.co/UBOLe43vJf https://t.co/YJJECoR2af
24638	1065757455785828353	2018-11-22 19:02:32	eventosyservic1	@Just_Alejo @idubogota @GobiernoBTA @IDTBogota @Bocarejo_JP @Bogota @sgeneralbogota @TransMilenio @CanalCapital @SectorMovilidad @UMVbogota @EnriquePenalosa Ya tu sabes, petristas resentidos y desocupados...
36007	1058204023734657024	2018-11-01 22:47:54	everodrigo	@TransMilenio @EnriquePenalosa @Bogota @G1CiudadMovil @ETIB_SAS @SectorMovilidad @BogotaTransito @idubogota ¿optimizar?... La ruta B12 en la estación calle 100 tiene demoras hasta de 40 minutos mientras en frente pasan buses vacíos todo el tiempo... ¿han mirado la demanda y la congestión de pasajeros ahí? Obvio que no porque están haciendo campañas inútiles qué no optimizan nada!!
24714	1059925816270839811	2018-11-06 16:49:41	fabiancsp	@Bogota @EnriquePenalosa Es inconcebible que mas de 6 billones de pesos en la renovación de una flota de buses obsoleta @TransMilenio con ese dinero se podria construir la primera línea del metro.
24813	1051837928484364288	2018-10-15 09:11:19	fegahu	Qué tan grande es el hueco fiscal que dejó el pasado gobierno comparado a los anteriores https://t.co/OYh3ioxTbZ
24929	1067867655808405507	2018-11-28 14:47:43	filoduglas	@mauroramirezgar @paoguerreroi @ciudadanocomun Y?. Luego las marchas son para delinquir?
24969	1072998718104838144	2018-12-12 18:36:44	fmb453	@CanalCapital @TransMilenio @EnriquePenalosa Y por qué para el lado donde vive gente más humilde buses Diesel? Exijo la misma promesa para la nueva troncal que realizarán por la avenida Cali
25011	1072951474752290817	2018-12-12 15:29:00	fran9579	@EnriquePenalosa El único desarrollo que yo le veo a Bogotá son los miles de huecos y políticos que se roban el presupuesto de la ciudad  y no los meten ala carcel, debería darle vergüenza decir que desarrolló , frase de mediocres
25120	1073349655382106112	2018-12-13 17:51:14	friveragaona	@TransMilenio Abran la Hijuepta estacion de museo nacional! Parranda de hijueputas inutiles
25195	1059867192542543872	2018-11-06 12:56:44	galaupn	@luciabastidasu @TransMilenio No será más bn que queremos que se implementen tecnologías limpias como en el transantiago
25241	1061615222530760707	2018-11-11 08:42:47	garrotiando	AQUÍ ESTÁ UNA PUREBA MÁS DEL ASESINATO COLECTIVO DE LA @PoliciaColombia A FIN DE ACABAR LAS MANIFESTACIONES PACÍFICAS A TRAVÉS DE TERRORRISTAS POLOCHOS INFLITRADOS. TAN INUHUMANOS COMO LAS FARC Y ELN. IGUALITOS. https://t.co/EBy5lauIzI
36030	1048279390986145795	2018-10-05 13:30:57	geovann40358591	@Citytv ???????? Pero si la plata recolectada del sitp  se queda en bolsillo de privados,  (dueños del transporte disque publico en bogota)......por que el pueblo debe pagar?......
25364	1067064563156303872	2018-11-26 09:36:31	giovannaprojas	@EnriquePenalosa hoy tuve que dejar pasar 19 buses de transmilenio con sobrecupo en la misma ruta antes de lograr subirme en uno, excelente su transporte, debería probarlo! Valientes los que usan su sistema, la pura necesidad!!!! 😡🤯
25370	1047122638278156288	2018-10-02 08:54:26	giovannotymilan	@joseluisdigital @TransMilenio @EnriquePenalosa Pero TM es el sistema mas seguro de trasporte en bogota y lo critican por un sistema que no funciona en un 100% pero no critican los actores viales ilegales que son los que deberian de persiguir y atacar para extinguirlos.
25447	1055667213376647169	2018-10-25 22:47:31	gordig0	@TransMilenio @SectorMovilidad Lastimosamente, no recuerdo el número del móvil en el que iba pero sí, que salió de aprox a las 7:50 de la estación calle 76 ruta G52
